,author,created_utc,id,num_comments,subreddit,text,clean_text
311,TangoCJuliet,1525569895.0,8hbx8p,2,datascience,"I was looking into applications of the random forest classifier, and stumbled upon this post:

https://partyondata.com/2011/09/21/betting-on-ufc-fights-a-statistical-data-analysis/

What’s really interesting was that the analyst was able to extract the individual strong classifiers out of the random forest and make individual insights using the predictors. I’ve not written such a model from scratch but using statistical packages (e.g. Scikit-Learn) the classifier doesn’t output insights such as these showing how the various predictors interact. Does anyone know how that can be done? 

E.g. Given a binary classification problem, train a random forest classifier using a dataset with 500 attributes; Attribute 25 and 145 were identified as a particularly strong classifier with x% errorHow can we select the strongest decision tree classifiers in a random forest?",looking applications random forest classifier stumbled upon post https partyondata com betting ufc fights statistical data analysis really interesting analyst able extract individual strong classifiers random forest make individual insights using predictors written model scratch using statistical packages e g scikit learn classifier output insights showing various predictors interact anyone know done e g given binary classification problem train random forest classifier using dataset attributes attribute identified particularly strong classifier x errorhow select strongest decision tree classifiers random forest
312,system3601,1525605500.0,8hel13,0,datascience,The New Stand-alone Power Query Engine Can Load Straight to Azure Storage,new stand alone power query engine load straight azure storage
313,happytravelbug,1525592558.0,8hdrap,18,datascience,"5 years ago someone running generic scikit learn models on their laptop memory, writing sql and also putting together dashboards would have been a standard Data Scientist.

But in those 5 years we have seen ML go from running Log Regressions and pasting results in a powerpoint, to Deep Learning becoming finally computationally feasible, GPUs and more GPUs, the advent of AWS, advancements in Reinforcement Learning, NLP, AI and Computer Vision that are going to push the boundaries even more in ML with old school supervised learning becoming less and less important giving way to a more hybrid form of AI, and ML becoming a core software engineering product at many of the best tech companies with many amazing novel case studies.

ML has firmly moved towards engineering in the tech industry regardless of what the statisticians like to think here. Many companies have already adopted to this realization by renaming their roles to be ""Machine Learning Engineer"" or ""Research Scientist"" or ""Applied Scientist"" often with PhD requirements. I now view data science as data extraction, analysis and statistical experimentation. There is simply no value to do ML work if you lack software engineering skills today.

As such the skillsets are very different. It's not fair to either type of person if the two are conflated as one. It's time to split.It's time for Machine Learning to leave the Data Science Profession Behind",years ago someone running generic scikit learn models laptop memory writing sql also putting together dashboards would standard data scientist years seen ml go running log regressions pasting results powerpoint deep learning becoming finally computationally feasible gpus gpus advent aws advancements reinforcement learning nlp ai computer vision going push boundaries even ml old school supervised learning becoming less less important giving way hybrid form ai ml becoming core software engineering product many best tech companies many amazing novel case studies ml firmly moved towards engineering tech industry regardless statisticians like think many companies already adopted realization renaming roles machine learning engineer research scientist applied scientist often phd requirements view data science data extraction analysis statistical experimentation simply value ml work lack software engineering skills today skillsets different fair either type person two conflated one time split time machine learning leave data science profession behind
314,malacusquai,1525538994.0,8h8qgm,6,datascience,"I have a very specific problem I am trying to tackle and I was wondering if anyone here had any ideas or papers they can point me to.  We run tests which generate tons of log files.  The number and type of log files varies with the type of test.  We take the failures and put them into sightings that get assigned to engineers for debug. 

I want to create a machine learning system that analyzes the generated log files and automatically groups The failures based on the similarities in the log files.  There is a lot of information about how to cluster log files with the ""bag of words"" approach but my scenario has some interesting challenges that I am trying to work through.

1. The are multiple log files per failure.  I need to group the failures not the files specifically.
2. There are thousands of words in each log file but likely there will only be 10-20 that are important in classifying/grouping the failure.
3. I want the system to learn from the past so if an engineer regroups the failures it will use this information in the future.
4. Often there will only be groups of 1 so a new set of failures could have many groups of similar failures or few groups.

I have tried the following supervised approach which was unsuccessful.
1. Get past failures with their sightings as a training set
2. Extract word frequencies for each log file. 
3. For each log file, find the cosine distance from every failures bag of word to every other failure.  There are n(n-1)/2 records now.
4. Find the outputs which is 1 if the two records have the same sighting and 0 otherwise.
5.  The output of these steps is nxm matrix where the rows are the  failure pairs and the columns are the log files. Each element is the cosine distance for that pair and log file.
6.  I feed the nxm and the outputs into a learning model. (I tried naive Bayes, knn, random forest)
7. For new failures I generate the same matrix and determine the output.

What's the problem? The system almost always guesses 0 for the pairs.  I think the issue is that the 1s (pairs in the same sighting) are sparse so the model just normally guesses 0 and is right 95 percent of the time. Also logs that are different tent to have high cosine distance even when they are different because so many of the irrelevant words are the same.

I was thinking semi unsupervised approach may be better here.  Any ideas or hints?Clustering log file sets",specific problem trying tackle wondering anyone ideas papers point run tests generate tons log files number type log files varies type test take failures put sightings get assigned engineers debug want create machine learning system analyzes generated log files automatically groups failures based similarities log files lot information cluster log files bag words approach scenario interesting challenges trying work multiple log files per failure need group failures files specifically thousands words log file likely important classifying grouping failure want system learn past engineer regroups failures use information future often groups new set failures could many groups similar failures groups tried following supervised approach unsuccessful get past failures sightings training set extract word frequencies log file log file find cosine distance every failures bag word every failure n n records find outputs two records sighting otherwise output steps nxm matrix rows failure pairs columns log files element cosine distance pair log file feed nxm outputs learning model tried naive bayes knn random forest new failures generate matrix determine output problem system almost always guesses pairs think issue pairs sighting sparse model normally guesses right percent time also logs different tent high cosine distance even different many irrelevant words thinking semi unsupervised approach may better ideas hints clustering log file sets
315,zerotohero16,1525494602.0,8h5810,3,datascience,"I’m trying to find a dataset that I can run some analysis for school work. Need to perform analysis with respect to segmentation/price elasticity/CLV and such marketing metrics. Looking through Kaggle datasets it is tough to find any datasets that I can do this sort of analysis, with a well defined business problem. Anyone have any other sources you can point me to or willing to share a dataset that can be used for this case?

TIA!Trying to find a good dataset for Marketing Analytics",trying find dataset run analysis school work need perform analysis respect segmentation price elasticity clv marketing metrics looking kaggle datasets tough find datasets sort analysis well defined business problem anyone sources point willing share dataset used case tia trying find good dataset marketing analytics
316,one_game_will,1525500966.0,8h5q8a,5,datascience,"I'm a DS in a hospital and have been given a part of my time for 'blue sky' projects based on the hospital's data. I want to develop my DS skill set, and wondered how people here split their time between doing DS with familiar tools and keeping up with all the latest developments in the field. 

Do you have time to keep up with the bleeding edge (mostly ML) alongside your day job?Balancing bleeding edge research vs cutting edge implementations in DS",ds hospital given part time blue sky projects based hospital data want develop ds skill set wondered people split time ds familiar tools keeping latest developments field time keep bleeding edge mostly ml alongside day job balancing bleeding edge research vs cutting edge implementations ds
317,malgamves,1525529362.0,8h7ql7,4,datascience,These seem particularly hard to find! Where can I get these? I need xrays of ARDS patients.Medical Image datasets,seem particularly hard find get need xrays ards patients medical image datasets
318,Unnam,1525492106.0,8h50af,0,datascience,Analytics for Startups : A plausible journey,analytics startups plausible journey
319,palms1,1525470759.0,8h2xne,9,datascience,"This is my first post in the sub, i always wanted to become a data analyst, so my first opportunity came. 
I was asked to estimate number of visitors in a store based on number of past visitors/day and number of people in the same area as the store/day.

I'm trying to model the question using PyMC3 (the only requirement).

Here is a example of the data = http://imgur.com/a/CZfkla7

I'm trying to model using a Poisson distribution and using some features that i thought might be important, like if it was a Holiday, if it was weekend and so on.

My question is, am i going the right way to tackle the problem? Any suggestions?

Thanks guys!



[Question] - How do i estimate number of visitors in a store based on past visits and number of visitors in the same area?",first post sub always wanted become data analyst first opportunity came asked estimate number visitors store based number past visitors day number people area store day trying model question using pymc requirement example data http imgur com czfkla trying model using poisson distribution using features thought might important like holiday weekend question going right way tackle problem suggestions thanks guys question estimate number visitors store based past visits number visitors area
320,bringthespooky,1525479735.0,8h3wch,4,datascience,"I am writing a math paper for high school based on logistic regression, wanting to predict chances of acceptance for some speific university based on GPA and SAT as the continuous variables. I found useful graphs on Cappex, but can't seem to find any raw data, does anyone know any sources? thanks :)Where to find raw data on university admissions with GPA and SAT scores?",writing math paper high school based logistic regression wanting predict chances acceptance speific university based gpa sat continuous variables found useful graphs cappex seem find raw data anyone know sources thanks find raw data university admissions gpa sat scores
321,amthinks,1525510931.0,8h6ec6,7,datascience,"Hello there, we've carried out a survey as a school project. We interviewed 273 people. The topic was renewable energy. Now we face a problem: we need to analyse data (15 questions) possibly also based on gender, age, location, etc, but we don't know any programme that could help us, and we don't want to count and calculate everything manually 😅. Does anybody have suggestions?Free/ Low Cost software to analyse data?",hello carried survey school project interviewed people topic renewable energy face problem need analyse data questions possibly also based gender age location etc know programme could help us want count calculate everything manually anybody suggestions free low cost software analyse data
322,delpee,1525428357.0,8gy46f,31,datascience,"While working on some small data science jobs I spent a lot of time on pulling data from different sources (sheets, APIs, etc.) and wrangling and processing this data in order to be able to work it.

- How much time do you men and women of r/datascience spend on it (in percentages)?
- What tools do you use to make this process more efficient?

If I find out I'm not the only one feeling like a clerk, I might develop a tool to make it easier :).How much time do you spend on gathering and processing?",working small data science jobs spent lot time pulling data different sources sheets apis etc wrangling processing data order able work much time men women r datascience spend percentages tools use make process efficient find one feeling like clerk might develop tool make easier much time spend gathering processing
323,heartofchrome44,1525383668.0,8gu1la,76,datascience,"I work for a major company in a small-ish Southern city that certainly is not on the radar of most people as being a destination.  We recently posted an entry-level data analyst position with ‘data science’ leanings and received over 600 applications.

That, combined with the fact that boards such as this are flooded with people wanting to get into, or switch careers into, data science makes me think that the market has to reach saturation very soon.  I have some decent experience and I still feel like I can’t leave my job because my resume will never make it to anyone’s desk without an inside reference, given the sheer number of applications going out.

I also feel (and I could very well be wrong) that data science often does not provide the business value that it’s cracked up to have.  When companies start to realize this, the demand may start to shrink.

Will the bubble burst? What does the field look like when it does?What happens when the bubble bursts?",work major company small ish southern city certainly radar people destination recently posted entry level data analyst position data science leanings received applications combined fact boards flooded people wanting get switch careers data science makes think market reach saturation soon decent experience still feel like leave job resume never make anyone desk without inside reference given sheer number applications going also feel could well wrong data science often provide business value cracked companies start realize demand may start shrink bubble burst field look like happens bubble bursts
324,the-data-scientist,1525350182.0,8gpyap,100,datascience,"Saying this because I'm confused about the amount of people on here banging on about how much Stats you need to know. Specifically stuff like ANOVA, t-tests, p-values, inference, hypothesis testing, experiment design etc

I've been in industry for 3 years across 2 companies and I've barely used any of this stuff. I spend the majority of my time building predictive machine learning models in Python and then productionising them. A model is a good model if it has sufficient accuracy/precision/auroc/{insert metric here} on validation data, and I don't care if it's statistically valid or not. I feel like I'm more software engineer than statistician, except with some specialist knowledge of how some ML algs work. Knowing about unit testing, continuous integration and software architecture has been more important to me than knowing about probability distributions, random variables and bayes' theorem.

I wonder are there a hell of a lot of people out there with the same job title as me who are actually doing a completely different job? Do the stats people amongst you do more analytics style stuff, or more descriptive than predictive work? It would be very interesting to know.Am I the only data scientist who doesn't use much statistics in their job?",saying confused amount people banging much stats need know specifically stuff like anova tests p values inference hypothesis testing experiment design etc industry years across companies barely used stuff spend majority time building predictive machine learning models python productionising model good model sufficient accuracy precision auroc insert metric validation data care statistically valid feel like software engineer statistician except specialist knowledge ml algs work knowing unit testing continuous integration software architecture important knowing probability distributions random variables bayes theorem wonder hell lot people job title actually completely different job stats people amongst analytics style stuff descriptive predictive work would interesting know data scientist use much statistics job
325,jpulliza,1525370169.0,8gscaj,1,datascience,Jupyter Notebook wins ACM award,jupyter notebook wins acm award
326,josh_c,1525381623.0,8gtsjs,13,datascience,"I would really appreciate input from experienced data scientists to address this question.

I'm considering taking the plunge to immersive myself in studying data science, but I came across something that really sticks out to me. 

The article I'm referring to can be found here:

https://www.rdisorder.eu/2017/09/13/most-difficult-thing-data-science-politics/

An intersting/funny/scary section of the article:

*Being able to communicate is the most important skill you can have to do this job, if you’re not able to communicate effectively at every company level you won’t be able to make a career out of this job. If you can’t communicate well, people are going to see you as Anton Chigurh (the guy in the pic): a weird guy approaching with an obscure tool trying to exterminate them.*

It seems that data science is so new and misunderstood, that data scientists can be viewed as the enemy or outcast among their coworkers at a company. 

Does this article paint an accurate picture of what it's like to be a data scientist?

As a data scientist, do you feel as though you are part of a team? Or are you constantly misunderstood and looked at as the company exterminator? 

I honestly don't want to pursue this career if I'm always looked at with contempt. 

I want a rewarding career and to feel as though I'm part of a team with my coworkers, uniting together to accomplish the same goal. 

Please be honest, I truly want to know. If this isn't for me, it isn't for me. 
[Serious] Are data scientists viewed as the enemy and/or outcast within their own company?",would really appreciate input experienced data scientists address question considering taking plunge immersive studying data science came across something really sticks article referring found https www rdisorder eu difficult thing data science politics intersting funny scary section article able communicate important skill job able communicate effectively every company level able make career job communicate well people going see anton chigurh guy pic weird guy approaching obscure tool trying exterminate seems data science new misunderstood data scientists viewed enemy outcast among coworkers company article paint accurate picture like data scientist data scientist feel though part team constantly misunderstood looked company exterminator honestly want pursue career always looked contempt want rewarding career feel though part team coworkers uniting together accomplish goal please honest truly want know serious data scientists viewed enemy outcast within company
327,SummarizeDev,1525384668.0,8gu61m,0,datascience,Postman API Network Exploration: Data analysis and management using the Postman Client,postman api network exploration data analysis management using postman client
328,chrisvacc,1525360996.0,8gr68t,2,datascience,"Data, R, and a 3-D Printer - 3D Printed Basketball Stats (Flowing Data)",data r printer printed basketball stats flowing data
329,happy_pandaz,1525330150.0,8gof4z,9,datascience,"Data viz showing how people have been moving across the US based on Thumbtack data. Made by the data science team at Thumbtack.  

Originally from:

[https://www.thumbtack.com/engineering/visualizing\-200k\-movers/](https://www.thumbtack.com/engineering/visualizing-200k-movers/)

https://i.redd.it/p8wh8kb38lv01.pngVisualizing 200K Moving Job Requests on Thumbtack in R",data viz showing people moving across us based thumbtack data made data science team thumbtack originally https www thumbtack com engineering visualizing k movers https www thumbtack com engineering visualizing k movers https redd p wh kb lv pngvisualizing k moving job requests thumbtack r
330,Minimalx,1525357234.0,8gqpwj,8,datascience,"Hey guys! First time post for me in this sub.

I wanted to ask for help, I have a challenge at my current job at a bank, we want to find out which of our customers are related to each other and the type of relation that they have, i.e. Son, Father, Mother, Son, Sibling, and so on.

The data I have available is everything related to the financial transactions of each customer and their basic data like name, sex, age, etc.

I haven't been able to find much literature about this topic so I would greatly appreciate any help.Detecting customer relationship using their financial data.",hey guys first time post sub wanted ask help challenge current job bank want find customers related type relation e son father mother son sibling data available everything related financial transactions customer basic data like name sex age etc able find much literature topic would greatly appreciate help detecting customer relationship using financial data
331,coalcracker462,1525307510.0,8gmb2g,40,datascience,What would have been the ideal randomization technique for Thanos to use to wipe out half of humanity?In Avengers Infinity War...,would ideal randomization technique thanos use wipe half humanity avengers infinity war
332,dab101256,1525301778.0,8glokq,4,datascience,"So I'm trying to study for an exam and in regards to decision trees, here are two points:
1. What **output statistic** is the best indicator of accuracy
2. What **measure** is widely considered to be the best indicator of predictive accuracy?

I can tell you for the second point it's cross validation error but I'm not sure what the professor is wanting for the first.In decision tree analysis, which output statistic is the best indicator of accuracy?",trying study exam regards decision trees two points output statistic best indicator accuracy measure widely considered best indicator predictive accuracy tell second point cross validation error sure professor wanting first decision tree analysis output statistic best indicator accuracy
333,redditperson24,1525262840.0,8ggvx4,148,datascience,"As a data analyst who doesn’t deal with huge data sets, I always use Excel. For people who deal with larger data sets, what’s the advantage of using something like python instead of excel?

Edit: thank you all so much for taking the time to respond, I am on the verge of being offered a data science role (final round tomorrow) so will hopefully be able to stop using excel! 

Edit 2: I got the job woooooWhy Python over excel?",data analyst deal huge data sets always use excel people deal larger data sets advantage using something like python instead excel edit thank much taking time respond verge offered data science role final round tomorrow hopefully able stop using excel edit got job wooooowhy python excel
