,author,created_utc,id,num_comments,subreddit,text,clean_text
0,Omega037,1526405269.0,8jneyb,36,datascience,The Mod Team has decided that it would be nice to put together a list of recommended books  similar to  the podcast list  https   www reddit com r datascience wiki podcasts      Please post any books that you have found particularly interesting or helpful for learning during your career   Include the title with either an author or link     Some restrictions     Must be directly related to data science   Non  fiction only   Must be an actual   book    not a blog post  scientific article  or website   Nothing self  promotional           My recommendations      Machine Learning  A Probabilistic Perspective  https   www cs ubc ca  murphyk MLbook      Computer Age Statistical Inference  https   web stanford edu  hastie CASI      Data Analysis Using Regression and Multilevel Hierarchical Models  http   www stat columbia edu  gelman arm      Design and Analysis of Experiments  https   www wiley com en us Design and Analysis of Experiments  C  th Edition p                   Data Mining  Concepts and Techniques  https   www amazon com Data Mining Concepts Techniques Management dp                Active Learning  https   www morganclaypool com doi abs         S     ED V  Y      AIM        All of Statistics  A Concise Course in Statistical Inference  https   www springer com us book               DS Book Suggestions Recommendations Megathread,mod team decided would nice put together list recommended books similar podcast list https www reddit com r datascience wiki podcasts please post books found particularly interesting helpful learning career include title either author link restrictions must directly related data science non fiction must actual book blog post scientific article website nothing self promotional recommendations machine learning probabilistic perspective https www cs ubc ca murphyk mlbook computer age statistical inference https web stanford edu hastie casi data analysis using regression multilevel hierarchical models http www stat columbia edu gelman arm design analysis experiments https www wiley com en us design analysis experiments c th edition p data mining concepts techniques https www amazon com data mining concepts techniques management dp active learning https www morganclaypool com doi abs ed v aim statistics concise course statistical inference https www springer com us book ds book suggestions recommendations megathread
1,Omega037,1527208553.0,8lxn0s,57,datascience,"Welcome to this week's 'Entering &amp; Transitioning' thread!

This thread is a weekly sticky post meant for any questions about getting started, studying, or transitioning into the data science field.

This includes questions around learning and transitioning such as:

* **Learning resources** \(e.g., books, tutorials, videos\)
* **Traditional education** \(e.g., schools, degrees, electives\)
* **Alternative education** \(e.g., online courses, bootcamps\)
* **Career questions** \(e.g., resumes, applying, career prospects\)
* **Elementary questions** \(e.g., where to start, what next\)

We encourage practicing Data Scientists to visit this thread often and sort by new.

You can find the last thread here:

[https://www.reddit.com/r/datascience/comments/8k8xof/weekly\_entering\_transitioning\_thread\_questions/](https://www.reddit.com/r/datascience/comments/8k8xof/weekly_entering_transitioning_thread_questions/)Weekly 'Entering &amp; Transitioning' Thread. Questions about getting started and/or progressing towards becoming a Data Scientist go here.",welcome week entering amp transitioning thread thread weekly sticky post meant questions getting started studying transitioning data science field includes questions around learning transitioning learning resources e g books tutorials videos traditional education e g schools degrees electives alternative education e g online courses bootcamps career questions e g resumes applying career prospects elementary questions e g start next encourage practicing data scientists visit thread often sort new find last thread https www reddit com r datascience comments k xof weekly entering transitioning thread questions https www reddit com r datascience comments k xof weekly entering transitioning thread questions weekly entering amp transitioning thread questions getting started progressing towards becoming data scientist go
2,slabby,1527645994.0,8n4ui3,37,datascience,"I don't know what subreddit is best for this post. Sorry if it's not this one.

So I'm a data analyst, not a data scientist. I just finished grad school (not data science) and I'm between jobs and about to move to a new city, so I've been taking the last few weeks to go through Datacamp's material fairly intensely (~4 hours a day) to upgrade my skills before I get my hopes and dreams crushed by the job market.

...


The **first** thing I noticed about Datacamp was that they did a lot of stuff *for* me. I'd open up an exercise and most of the code had been written already, with a couple of spaces with '____' where I should fill in the right answer. I thought this was really frustrating, because there was never any point in the process where they explained to me why we needed to perform whatever operation it was. I'm like 50 hours in, and I'm not sure I could do any of this without Datacamp's prompting. I think this is the worst part of the Datacamp curriculum. I feel that I'm paying Datacamp to teach me Python syntax and when to use it (not just how to use it), and I feel like I'm not learning either of those things.

**Second,** although Datacamp courses offer short video segments that putatively ""teach"" the course, the exercises were essentially big text boxes. Oftentimes the video and text would be somewhat out of sync, and sometimes it felt like entire sections had been omitted between text and video. This made watching the videos almost completely optional, and considering most of them are shorter than 5 min, there was never enough time to substantively introduce the material anyway.

**Third**, the exercises rarely feel practical. There are some nice real-world datasets used, but because of what I describe in my first paragraph, it's hard to actually interface with them. You're not really working with them yourself. Beyond that, it doesn't feel like Datacamp spends a lot of time trying to motivate the problem. Why do we need to take this approach, etc. There are often domain-specific considerations that influence how the problem may best be solved, and that stuff is completely omitted. This ends up meaning that these supposedly practical exercises end up anything but.

I had a really long paragraph here about how **I dislike their two-part statistics course**. TL;DR: I thought the treatment of linear regression was really shallow and incomplete (there's no mention of residuals at all, for example), and I thought leaving out multiple and logistic regression meant it didn't provide enough for students to actually learn how to work with data. I've never worked as a data scientist, but I understand that those two are important. They're already super useful as an analyst.

**That's not to say that Datacamp is terrible.** I really liked some of the data viz stuff they've got (Seaborn and Bokeh are awesome), and I think their first couple of intro to Python courses are helpful. I've heard great things about their R courses, as well. And Datacamp has got a great platform for what they're doing.

I'm certainly going to finish my month of Datacamp, but I don't think I'll be resubscribing. I know it's kind of a cheap shot, but I feel like I might subscribe to one of their competitor products in the hope that they can teach me more of the syntax and thought process behind this stuff. I'm disappointed to be paying somebody to teach me, only to have to Google what they're supposed to be teaching.My Review: Unimpressed with Datacamp (for Python)",know subreddit best post sorry one data analyst data scientist finished grad school data science jobs move new city taking last weeks go datacamp material fairly intensely hours day upgrade skills get hopes dreams crushed job market first thing noticed datacamp lot stuff open exercise code written already couple spaces fill right answer thought really frustrating never point process explained needed perform whatever operation like hours sure could without datacamp prompting think worst part datacamp curriculum feel paying datacamp teach python syntax use use feel like learning either things second although datacamp courses offer short video segments putatively teach course exercises essentially big text boxes oftentimes video text would somewhat sync sometimes felt like entire sections omitted text video made watching videos almost completely optional considering shorter min never enough time substantively introduce material anyway third exercises rarely feel practical nice real world datasets used describe first paragraph hard actually interface really working beyond feel like datacamp spends lot time trying motivate problem need take approach etc often domain specific considerations influence problem may best solved stuff completely omitted ends meaning supposedly practical exercises end anything really long paragraph dislike two part statistics course tl dr thought treatment linear regression really shallow incomplete mention residuals example thought leaving multiple logistic regression meant provide enough students actually learn work data never worked data scientist understand two important already super useful analyst say datacamp terrible really liked data viz stuff got seaborn bokeh awesome think first couple intro python courses helpful heard great things r courses well datacamp got great platform certainly going finish month datacamp think resubscribing know kind cheap shot feel like might subscribe one competitor products hope teach syntax thought process behind stuff disappointed paying somebody teach google supposed teaching review unimpressed datacamp python
3,mvelasco93,1527700085.0,8naak0,7,datascience,"Hi!

I'm currently organizing a ""hackathon"" on my university in Ecuador. Currently, there are two categories which are data analysis and prototyping. The data is given by a private company. I don't want to use the word ""hackathon"" since it have a negative connotation for beginners or non-coders and we don't want that. While data can be analyzed with code, not all people know how to but they know other tools. Prototyping is the same (based on the data we give) since you can use tools for the data's nature. We are starting this year and we are planning this event can continue yearly. 

Thanks!Alternative name for ""hackathon""",hi currently organizing hackathon university ecuador currently two categories data analysis prototyping data given private company want use word hackathon since negative connotation beginners non coders want data analyzed code people know know tools prototyping based data give since use tools data nature starting year planning event continue yearly thanks alternative name hackathon
4,DiogenicOrder,1527686427.0,8n8ig6,2,datascience,"Hey guys and gals, wondering about how you went about volunteering for data science, where was it, how did you meet the people to begin with?

Were you contacted or did you look for something specific?

Thanks!For people who volunteered, what's your story?",hey guys gals wondering went volunteering data science meet people begin contacted look something specific thanks people volunteered story
5,dbsopinion,1527701890.0,8najne,2,datascience,"What method do you use to determine whether the statistics published in an article (e.g. newspaper) are either wrong or presented to support the author’s point of view, rather than correct, comprehensive factual information on a specific subject?",method use determine whether statistics published article e g newspaper either wrong presented support author point view rather correct comprehensive factual information specific subject
6,DSgirl90,1527679608.0,8n7spw,3,datascience,"I just got a PhD on statistics and ML. I got two job offers to work as a (junior) Data Scientist, one is in a bank and the other is in an Airline firm (both in the UK). It seems that the position in the bank is starting to introduce more ML techniques into their models (for credits, risk management) and the role at the Airline company is more about using ML / DL techniques to improve their service, products, etc. I am not sure what is a better move at the moment. I am tempted by the bank position since I have no background in finance and this opportunity would help me to get introduced into this field. But I am not sure if in the next 2-5 years there will be more open positions in finance or in ""tech"" sort of companies. Any advice would be appreciated :)Data Science in Finance or in Aviation?",got phd statistics ml got two job offers work junior data scientist one bank airline firm uk seems position bank starting introduce ml techniques models credits risk management role airline company using ml dl techniques improve service products etc sure better move moment tempted bank position since background finance opportunity would help get introduced field sure next years open positions finance tech sort companies advice would appreciated data science finance aviation
7,gufranmirza,1527696789.0,8n9uiu,0,datascience,Functional Data Engineering?—?a modern paradigm for batch data processing - Ednsquare,functional data engineering modern paradigm batch data processing ednsquare
8,tokkimaster,1527645470.0,8n4sem,0,datascience,"Hi!

I've been posting here a lot and everyone's been super helpful so far.

As you know, I'm going to be a Grad Student soon.  I've been looking at some companies that I wanted to work for / fields that interest me but I realized,

It's very hard to find information on Forensics / Gov't Contract Firms that require Data Science as a skillset.

Are there a lot of jobs like that out there or is the field already saturated?

Thank You!Forensic / Law Enforcement / Gov't Contract Firms?",hi posting lot everyone super helpful far know going grad student soon looking companies wanted work fields interest realized hard find information forensics gov contract firms require data science skillset lot jobs like field already saturated thank forensic law enforcement gov contract firms
9,zindarod,1527615307.0,8n0zk1,22,datascience,"Some posts on reddit and quora mention that programmers without graduate degrees who study machine learning will not have much impact on the industry and their demand will diminish within the next 5 years. Granted they were mostly talking about those who focus on libraries, implementations and packages without understanding the fundamentals and the required math but it was discouraging none the less.

I am a machine learning and computer vision enthusiast, and my current reading list consists of:

**Machine Learning:**

* The Matrix Cookbook by Petersen et al.
* Linear Algebra and it's Applications by Gilbert Strang
* Think Stats by Downey et al.
* An Introduction to Statistical Learning with Applications in R by Hastie et al.
* Hands-On Machine Learning with Scikit-Learn and TensorFlow by Aurélien Géron

**Computer Vision:**

* Digital Image Processing by Gonzalez et al.
* Computer Vision: Algorithms and Applications by Richard Szeliski

After completing (hopefully) the above, I plan to read:

* The Elements of Statistical Learning by Hastie et al.
* Convex Optimization by Boyd et al.

Am I wasting my time by focusing on these topics without a graduate degree? Has anyone found success in these fields without graduate degrees?

**Edit**: I do have a BS degree in computer science.[x-post]Any Machine Learning success stories without graduate degrees?",posts reddit quora mention programmers without graduate degrees study machine learning much impact industry demand diminish within next years granted mostly talking focus libraries implementations packages without understanding fundamentals required math discouraging none less machine learning computer vision enthusiast current reading list consists machine learning matrix cookbook petersen et al linear algebra applications gilbert strang think stats downey et al introduction statistical learning applications r hastie et al hands machine learning scikit learn tensorflow aur lien g ron computer vision digital image processing gonzalez et al computer vision algorithms applications richard szeliski completing hopefully plan read elements statistical learning hastie et al convex optimization boyd et al wasting time focusing topics without graduate degree anyone found success fields without graduate degrees edit bs degree computer science x post machine learning success stories without graduate degrees
10,r4pid-,1527600833.0,8mz4iy,43,datascience,After some discussion I think I'm more confused on the difference between the two. Are they not interchangeable terms? Hope someone here can clarify!What is the difference between AI and Machine learning?,discussion think confused difference two interchangeable terms hope someone clarify difference ai machine learning
11,meowmixx76,1527643727.0,8n4lbz,0,datascience,Transfer Learning for the ISIC Melanoma Classification Challenge,transfer learning isic melanoma classification challenge
12,vamsden,1527607146.0,8mzwhv,2,datascience,"Any free soccer apis with live matches, goalscorer, players, result and standings? Minimum api calls are ok. For analytic testing Soccer Api",free soccer apis live matches goalscorer players result standings minimum api calls ok analytic testing soccer api
13,seacucumber3000,1527615616.0,8n1141,1,datascience,"So I posted a similar question last week, but the title was a little more vague. I'm pretty stuck on what to do, and I want to get this project finished ASAP.

I'm working on a project involving looking at windows of two data sets and, by shifting the one of the windows relative to the other, finding both the best correlation value and its associated shift.

The professor/researcher I'm working with asked if there's a way to ensure that there is enough variance between the two datasets to ensure good quality correlation values between the two sets (since windows with little variance can be correlated well at many different shifts). I wasn't sure of a way to do this, so I'm curious what the best way to do this is.

I'm also curious if you guys know of any other techniques to use ensure quality correlation and shift values for the windows.

Here's a longer write-up of the program:

Given two datasets of two years worth of data each:

1. Select the first 24-hour window for each dataset
2. Skip the window if it contains &gt;25% NaN
3. Resample the windows to 1-minute data (previously 15-second and 30-second data)
4. For a range (initially -100 minutes to 100 minutes) calculate the correlation, save correlation and shift to arrays, then move on to the next value in the range
5. Select the highest correlation and its associated shift
6. Resample the data into 30-minute windows (requirement according to researcher/prof. I'm working with)
7. Re-calculate the correlation at the best shift with the 30-minute window
8. Set the bounds in 4 to the (shift - 10 minutes) and (the shift + 10 minutes)
9. Output the new correlation and the shift
10. Repeat step one for a window shifted over 30 minutes

The data is from two spacecraft at a distance known only to be within a range. Since we're looking at the data from both, we need to match up the data in windows with a shift since the data recorded from one spacecraft is delayed respective to the other.

With the massive amounts of data, it's looking like the entire analysis will take ~5 hours (which I guess isn't too bad), but I'm hoping there are other ways to speed it up. I was originally doing each window calculation for the entire -100 minutes to +100 minutes range, but then I realized that the shift from window to window should be under 10 minutes difference compared to the prior window, so I can set bounds and not have to calculate unnecessary shifts (if that makes sense). It also ensures the shifts to be close to each other, since I was having issues with a few windows having drastically different shifts.

I hope that all makes sense! I'm 99% done with the program, it just needs some minor polishing like this, imo.How to ensure there is enough variance in two datasets to correlate",posted similar question last week title little vague pretty stuck want get project finished asap working project involving looking windows two data sets shifting one windows relative finding best correlation value associated shift professor researcher working asked way ensure enough variance two datasets ensure good quality correlation values two sets since windows little variance correlated well many different shifts sure way curious best way also curious guys know techniques use ensure quality correlation shift values windows longer write program given two datasets two years worth data select first hour window dataset skip window contains gt nan resample windows minute data previously second second data range initially minutes minutes calculate correlation save correlation shift arrays move next value range select highest correlation associated shift resample data minute windows requirement according researcher prof working calculate correlation best shift minute window set bounds shift minutes shift minutes output new correlation shift repeat step one window shifted minutes data two spacecraft distance known within range since looking data need match data windows shift since data recorded one spacecraft delayed respective massive amounts data looking like entire analysis take hours guess bad hoping ways speed originally window calculation entire minutes minutes range realized shift window window minutes difference compared prior window set bounds calculate unnecessary shifts makes sense also ensures shifts close since issues windows drastically different shifts hope makes sense done program needs minor polishing like imo ensure enough variance two datasets correlate
14,seoulonfire,1527626704.0,8n2jhv,4,datascience,"So I have a categorical feature in a dataset that has 9000 unique values where a row may look something like below:

`['Pheochromocytoma', 'Gastrointestinal_stroma_tumor', 'Hereditary_cancer-predisposing_syndrome', 'Paragangliomas_4']`

This is obviously relevant information that I'd like to use in a model, but I'm stumped as to what the best way to go about handling a feature like this is, where one row contains multiple different values basically. They also vary in length: one rows list may contain any number of values.

My first thought is to split at the commas and create a new column for each unique value, but the coding logistics on how to achieve that across a big dataset where the values vary quite a bit start to get fuzzy real quick. Plus, this could start to create a massive feature set, where my goal currently is to reduce it. That's not as big of an issue though, as if it needs to be done that way, it needs to be done that way.

Any insight here is greatly appreciated!How to handle a specific feature.",categorical feature dataset unique values row may look something like pheochromocytoma gastrointestinal stroma tumor hereditary cancer predisposing syndrome paragangliomas obviously relevant information like use model stumped best way go handling feature like one row contains multiple different values basically also vary length one rows list may contain number values first thought split commas create new column unique value coding logistics achieve across big dataset values vary quite bit start get fuzzy real quick plus could start create massive feature set goal currently reduce big issue though needs done way needs done way insight greatly appreciated handle specific feature
15,joshman108,1527624100.0,8n26my,4,datascience,"For data science and analytics teams that you have worked on: how much of the work was just solving some problem you were given and how much was being responsible for finding and providing some actionable insight?

I am on a very newly developing data analytics team with no experience in the field myself and I am just curious to know what the norm even is. Thanks again.What percent work your work is generated from within and from outside of your team?",data science analytics teams worked much work solving problem given much responsible finding providing actionable insight newly developing data analytics team experience field curious know norm even thanks percent work work generated within outside team
16,mowglis_diaper,1527617858.0,8n1c2n,1,datascience,I need to identify who spoke when in a wav file. Ideally in RCan someone guide me through speaker diarization/segmention?,need identify spoke wav file ideally rcan someone guide speaker diarization segmention
