,author,created_utc,id,num_comments,subreddit,text,clean_text
150,chrisvacc,1526532021.0,8k1hmx,0,datascience,"I made these little snippets which creates a great little code snippet search database. It’s really good for when you’re like “Crap… what’s the exact syntax of a ggplot plot where I change the background?!” All you do is hit ⌘\+S \(or CTRL\+S or whatever you want to set it to\) and search ‘gg…’ or whatever your snippet is. Boom, comes right up. Or when you have long code you use a lot. You can title them however you want to title them to make them easy to search for.

Check it out: [Imgur Text Expander Gallery](https://imgur.com/a/BoZakgt) 

I made these snippets to make searchable snippets for three types of people. Aspiring Data Workers who want to learn the commands. Veterans who want to save time, or anyone who wants a searchable Database of codes. Who I didn’t make it for: lazy people who don’t want to memorize functions. Listen, especially if you’re new, you need to know these functions like you know your phone number. This is a tool to help you learn. Not to be used as a crutch. For veterans… 

I started making one for the Base package 📦 but my plan is: Turn R Studio’s \(very useful\) cheatsheets into searchable snippets. I’ve just had limited time. I was gonna make one set from each cheatsheet.

[R Studio: Cheatsheets](https://www.rstudio.com/resources/cheatsheets/)

So I want to make one set of snippets for each Cheatsheet, I’ve just been getting around to it slowly. I wanted to give these to you guys in the meantime before I finish OR If you guys find these useful and want contribute and make more, I set up a Google Drive Folder for us to edit:

[Google Drive: R Snippets](https://drive.google.com/drive/folders/1ESYOI6E7WF-lTtiMG9hv6YCWVOJ2tKjc?usp=sharing) 

We can make one for ggplot, dplyr, tibble, tidyr, etc etc etc. Just download and bring them into TextExpander.

Just download the Base R one to test out. If this proves popular I’ll make a more in depth tutorial.

If you guys wanna make some for python or whatever language, again, go for the gold. Just make a new “Python” Folder if you do.”

IMPORTANT: MAC USERS, TURN OFF [SMART QUOTATIONS](https://imgur.com/a/1u7VU4a). When I was making this I spent like 2 hours pulling my hair out because my ggplot code wouldn’t work. I looked my code over hundreds of t news, tested it until my fingers were almost bleeding

And I could NOT for the life of me figure out what was wrong with my code. It was perfect. Until I looked a little closer and noticed like 3 freaking pixels were off. The app was using smart quotes. I googled for another 30 minutes and I realized after years and years of owning Macs that there’s a freaking context menu right under my nose that lets you turn them off.TextExpander can be hacked to make a great little Universal Spotlight Search for code snippets, or hard-to-remember functions. (Great for Beginners just learning, or Veterans who want to save time.) Tutorial/Demo inside.",made little snippets creates great little code snippet search database really good like crap exact syntax ggplot plot change background hit ctrl whatever want set search gg whatever snippet boom comes right long code use lot title however want title make easy search check imgur text expander gallery https imgur com bozakgt made snippets make searchable snippets three types people aspiring data workers want learn commands veterans want save time anyone wants searchable database codes make lazy people want memorize functions listen especially new need know functions like know phone number tool help learn used crutch veterans started making one base package plan turn r studio useful cheatsheets searchable snippets limited time gonna make one set cheatsheet r studio cheatsheets https www rstudio com resources cheatsheets want make one set snippets cheatsheet getting around slowly wanted give guys meantime finish guys find useful want contribute make set google drive folder us edit google drive r snippets https drive google com drive folders esyoi e wf lttimg hv ycwvoj tkjc usp sharing make one ggplot dplyr tibble tidyr etc etc etc download bring textexpander download base r one test proves popular make depth tutorial guys wanna make python whatever language go gold make new python folder important mac users turn smart quotations https imgur com u vu making spent like hours pulling hair ggplot code work looked code hundreds news tested fingers almost bleeding could life figure wrong code perfect looked little closer noticed like freaking pixels app using smart quotes googled another minutes realized years years owning macs freaking context menu right nose lets turn textexpander hacked make great little universal spotlight search code snippets hard remember functions great beginners learning veterans want save time tutorial demo inside
151,ohne_bohne,1526504400.0,8jyh08,19,datascience,Can someone recommend this book or has a better alternative?,someone recommend book better alternative
152,electronicpockets,1526528534.0,8k151i,11,datascience,"I realise this type of question is quite open\-ended, and differs based on the industry, company culture, etc.

However, I was wondering what sorts of work environments are most common among data scientists? For instance, do you work in an open\-plan office, or do you work in a private space? Do many of you work remotely \(even if on a partial basis\)?

Would be very interested to hear what would be the norm for a data scientist as far as work environment goes.What is a typical work environment for a data scientist?",realise type question quite open ended differs based industry company culture etc however wondering sorts work environments common among data scientists instance work open plan office work private space many work remotely even partial basis would interested hear would norm data scientist far work environment goes typical work environment data scientist
153,Clous09,1526525048.0,8k0s5v,11,datascience,"I'm trying to see whether data science is something I might be interested in. What type of data do you mostly work with? I understand that this certainly changes from job to job but my impression is that most DS jobs out there are for business analytics. But what does that entail? Is it mostly pricing, ads, customer satisfaction data etc? What do data scientists on Reddit currently work on?

Thank you!What type of data do you work with in your DS job?",trying see whether data science something might interested type data mostly work understand certainly changes job job impression ds jobs business analytics entail mostly pricing ads customer satisfaction data etc data scientists reddit currently work thank type data work ds job
154,dab_fisher,1526492964.0,8jwynj,6,datascience,"Hey everyone:

Would you be interested in updates of the Bertelsmann Data Science Scholarship program? I applied and was accepted. I have some introduction to advance statistical analysis, as well as R, Stata and Python. I am hoping this program will solidify my understanding in theory, as well as advance in R and Python especially (among other data visualization tools). 

This program seems pretty new. It utilizes Udacity's learning platform. This way if anyone is interested in it the future they'll have some idea of what it entails. It began on May 8th.Interest in Bertelsmann Data Science Scholarship updates?",hey everyone would interested updates bertelsmann data science scholarship program applied accepted introduction advance statistical analysis well r stata python hoping program solidify understanding theory well advance r python especially among data visualization tools program seems pretty new utilizes udacity learning platform way anyone interested future idea entails began may th interest bertelsmann data science scholarship updates
155,awizardisneverlate,1526509971.0,8jz5dy,5,datascience,"Does anyone here work with HPC systems and data science? What do you do? Is there a specific subtype of data science that someone interested in HPC should focus on?

To give some background, I'm a 3rd year applied math PhD student. My field is mainly focused on Markov Chain Monte Carlo simulations and other similar algorithms. My passion is programming for high performance systems and the algorithms that make it possible. I'm looking at data science as a possible career path, and I was wondering if there's a way to keep my love of HPC while doing so. I don't know much about data science (as you can probably tell!). I have had substantial statistics courses and programming experience, though. High performance computing and data science?",anyone work hpc systems data science specific subtype data science someone interested hpc focus give background rd year applied math phd student field mainly focused markov chain monte carlo simulations similar algorithms passion programming high performance systems algorithms make possible looking data science possible career path wondering way keep love hpc know much data science probably tell substantial statistics courses programming experience though high performance computing data science
156,immunobio,1526523710.0,8k0n8o,2,datascience,I want to start applying to data science positions and I need to fix up my resume. Thanks!What kinds of projects would you expect a mid-level data scientist to complete?,want start applying data science positions need fix resume thanks kinds projects would expect mid level data scientist complete
157,ThatOtherBatman,1526495530.0,8jxb5x,5,datascience,"Hi all,  
I've got a couple of new employees who have just started, or about to start, working with us and need to learn Pandas.  
I originally used Wes McKinney's book, but I understand that even the new version is severely outdated on some points.  
I'm leaning towards getting them both a copy of Pandas Cookbook by /u/tedpetrou but would also like to hear about any other books or tutorials to hell get complete newbies up and running. Current References For Learning Pandas",hi got couple new employees started start working us need learn pandas originally used wes mckinney book understand even new version severely outdated points leaning towards getting copy pandas cookbook u tedpetrou would also like hear books tutorials hell get complete newbies running current references learning pandas
158,Boludo00,1526428742.0,8jqf3i,12,datascience,Python package for creating browser based interactive network visualizations,python package creating browser based interactive network visualizations
159,vaelroth,1526486762.0,8jw41p,5,datascience,"I work with a local health department and design reports for their community health program. One of the fields that we report on is patient age, but I'm stuck on how we should be calculating patient ages. The options that we have are:

* Age at time of visit (Seems best to me)

* Age at time of program enrollment (Would be consistent, but wouldn't indicate patients aging while in the program)

* Current age (Patients would still age after death unless we check for that and calculate it separately. The reporting tool we use isn't sophisticated enough to do this, so we'd have to export the data and do the work in excel.)

* Age at end of report period (Currently used by my predecessor.)

Any suggestions or help would be appreciated!How to calculate age for reporting?",work local health department design reports community health program one fields report patient age stuck calculating patient ages options age time visit seems best age time program enrollment would consistent indicate patients aging program current age patients would still age death unless check calculate separately reporting tool use sophisticated enough export data work excel age end report period currently used predecessor suggestions help would appreciated calculate age reporting
160,greenprius,1526484696.0,8jvu6q,0,datascience,Argonne researcher condenses output in search of insight,argonne researcher condenses output search insight
161,ohne_bohne,1526459536.0,8jtbvx,8,datascience,"Hi I'm quite new to Reddit, so please let me know if can improve something :)
I recently started working for a bank in the Marketing analysis department. They're often using visual tools like IBM SPSS and Orange to analyze data. I think the tool is ok if you want a quick solution, but when a project gets bigger it gets quite messy to maintain it and adapt. Am I wrong? What do you think about these tools?Visual data analysis tool vs python and SQL",hi quite new reddit please let know improve something recently started working bank marketing analysis department often using visual tools like ibm spss orange analyze data think tool ok want quick solution project gets bigger gets quite messy maintain adapt wrong think tools visual data analysis tool vs python sql
162,fortylightbulbs,1526477550.0,8juxlh,5,datascience,"[Here](https://imgur.com/a/CgCXDlr) is a shot of what the data looks like. There are 100,000+ rows. Top1match, 2, and 3 represent the name of the cluster the data point was found closest to. Top 1, 2, and 3 'Dist' represents the distance to its respective cluster.

I feel like there should be some way to convert this into a plot with the points clustered around their centroids using the distance numbers. But I'm not sure where to start. I've got lots of time so any suggestions would be helpful, this is my first real step moving away from basics and I'm looking to learn.How can I convert a cluster analysis output to a visual?",https imgur com cgcxdlr shot data looks like rows top match represent name cluster data point found closest top dist represents distance respective cluster feel like way convert plot points clustered around centroids using distance numbers sure start got lots time suggestions would helpful first real step moving away basics looking learn convert cluster analysis output visual
163,360Giving,1526398041.0,8jmg6y,13,datascience,"Hi everyone, not sure whether this fits as it's data visualisation more than data science per se, yet I hope that some of you will find it interesting. 

360Giving is running a data visualisation competition open for everyone. We are inviting you to use our dataset to visualise innovative solutions to two questions facing the grantmaking sector: 1. Who has funded what themes throughout the years? 2. User\-led organisations: Who funds them, in what thematic area, how much funding do they receive and what type of organisation are they?

Entries must use the 360Giving dataset to answer one of the questions and you are encouraged to use other datasets alongside it. You can find a list of suggested datasets [here](https://challenge.threesixtygiving.org/resources). The prizes of between £2,000 and £6,000 will be awarded to the best three responses to the questions. In addition, each entry that meets our submission criteria will receive an award of between £100 and £500 \(depending on the number of submissions and their quality\). The closing date for entries is 15th July. Winners will be announced in September 2018. You can find more info and submission guidelines [here](https://challenge.threesixtygiving.org/).

Let me know if you have any questions!Data visualisation competition",hi everyone sure whether fits data visualisation data science per se yet hope find interesting giving running data visualisation competition open everyone inviting use dataset visualise innovative solutions two questions facing grantmaking sector funded themes throughout years user led organisations funds thematic area much funding receive type organisation entries must use giving dataset answer one questions encouraged use datasets alongside find list suggested datasets https challenge threesixtygiving org resources prizes awarded best three responses questions addition entry meets submission criteria receive award depending number submissions quality closing date entries th july winners announced september find info submission guidelines https challenge threesixtygiving org let know questions data visualisation competition
164,mikkokotila,1526418709.0,8jp7yn,0,datascience,Hyperparameter Optimization with Keras – Towards Data Science,hyperparameter optimization keras towards data science
165,Cjh411,1526440208.0,8jrqcs,2,datascience,"I have to show a video to some people at work as part of a rotating series of videos, and I'm looking for a ML or data science video to show them.

Right now I'm planning on showing ""The Trouble with Bias"" by Kate Crawford from NIPS17, since data ethics is relevant to all, but I thought you might have some good suggestions. Any obvious contenders for outsiders to ML that would be interesting?Machine Learning Lectures for Outsiders to ML",show video people work part rotating series videos looking ml data science video show right planning showing trouble bias kate crawford nips since data ethics relevant thought might good suggestions obvious contenders outsiders ml would interesting machine learning lectures outsiders ml
166,Adi_2000,1526407067.0,8jnnh6,0,datascience,"What Anscombe's quartet's? ""Same Stats, Different Graphs: Generating Datasets with Varied Appearance and Identical Statistics through Simulated Annealing""",anscombe quartet stats different graphs generating datasets varied appearance identical statistics simulated annealing
167,citizenofacceptance2,1526357374.0,8jiqb2,39,datascience,What is the best online class to learn how to use python to automate work in excel and to aid in data analysis. Python online course oriented around excel automate/ data analysis,best online class learn use python automate work excel aid data analysis python online course oriented around excel automate data analysis
168,chef_lars,1526394415.0,8jlzdv,8,datascience,Two that I find helpful (and interesting) are [Mutual Information](https://thuijskens.github.io/2017/10/07/feature-selection/) and [Boruta](http://danielhomola.com/2015/05/08/borutapy-an-all-relevant-feature-selection-method/) for identifying relevant features from a large group.What are your preferred methods for feature selection? Any lesser known favorites?,two find helpful interesting mutual information https thuijskens github io feature selection boruta http danielhomola com borutapy relevant feature selection method identifying relevant features large group preferred methods feature selection lesser known favorites
169,chiv,1526409525.0,8jnzil,11,datascience,"I've been using Tableau and am really happy with it. Do any of the alternatives (Alteryx, PowerBI, Qlik, etc.) have any strengths to warrant using them instead of Tableau? Preferred Data Viz Tools?",using tableau really happy alternatives alteryx powerbi qlik etc strengths warrant using instead tableau preferred data viz tools
170,hgrif,1526367514.0,8jjli3,1,datascience,Elitist shuffle for recommendation systems,elitist shuffle recommendation systems
171,TGEL0,1526375387.0,8jk5q2,16,datascience,"So I used K-means from SKL to cluster a bunch of tracks from the Spotify Web API (which is amazing BTW). Here is the link to my notebook:

https://github.com/tgel0/tgel0.github.io/blob/master/Notebooks/SpotifyUnsupervised.ipynb

I want to compare the clusters in an efficient way to see what are the key differences etc. So far I'm looking at small samples from the clusters and comparing the histograms for each feature between them.

How would you do this in a more 'scientific' way?Ideas for efficiently comparing clusters of data in Python?",used k means skl cluster bunch tracks spotify web api amazing btw link notebook https github com tgel tgel github io blob master notebooks spotifyunsupervised ipynb want compare clusters efficient way see key differences etc far looking small samples clusters comparing histograms feature would scientific way ideas efficiently comparing clusters data python
172,Pik000,1526390902.0,8jlkgu,2,datascience,"Hi Guys,

I realise this might not be the 100% correct subreddit but I think its probably a specific DS problem over Python problem.

Been looking all night and cant find a definite answer

I have a folder structure like below


    images/
              /dog
                    /001.jpg
                    /002.jpg
              /cat
                    /001.jpg
                    /002.jpg
              /hamster
                    /001.jpg
                    /002.jpg

etc

Is there code or a function that will easily convert this into 

    images/
              /train
                    /dog
                          /001.jpg
                    /cat
                          /001.jpg
                    /hamster
                          /001.jpg
    images/
              /test
                    /dog
                          /002.jpg
                    /cat
                          /002.jpg
                    /hamster
                          /002.jpg

I have about 200 classes and about 2000 pictures in each folder so doing it manually isn't really an option.

Thanks guys.Creating a train/test split for a MultiLabel folder structure",hi guys realise might correct subreddit think probably specific ds problem python problem looking night cant find definite answer folder structure like images dog jpg jpg cat jpg jpg hamster jpg jpg etc code function easily convert images train dog jpg cat jpg hamster jpg images test dog jpg cat jpg hamster jpg classes pictures folder manually really option thanks guys creating train test split multilabel folder structure
173,namadio,1526404112.0,8jn9cc,5,datascience,"Hello!  I searched this sub for some visualization options and found a few libraries to investigate but I wanted to see if anyone had encountered a similar situation to this before.  
  
Lets say I collected some data and have 53000 unique entities in this data set.  Also, this data was collected over 13 different days.  So I created a 13x53000 matrix in Matlab with columns representing the unique entities and rows the days they were seen.  Most entities were only seen on 1 day but some were seen on 3-4 and  even 5 days.  The entries in the matrix are binary for whether the entity was collected on that day.

A colleague started making a stacked bar chart in Matlab and it looks horrendous.  Somone called it ""an eye chart"".  I've been tasked with making something thats not ""an eye chart.""   
  
Does anyone have any reccomendations on how to visualize this data?  I was thinking Dash, Seaborn, or even just the matplotlib stacked bar chart would be better but who knows.  

I'm using this as an opportunity to learn something new hopefully in Python.  I've been using Matlab for most of my scholastic and work pursits.  I'm proficient in non-OOP programming in C, remember a little Python (but have been experimenting with Tensorflow and Keras lately!) and understand basic concepts of OOP.   
  
I would really like to try this in Python first and learn something else like R down the road.  Thanks!!Python Visualization 13x53000 Matrix of Binary Data",hello searched sub visualization options found libraries investigate wanted see anyone encountered similar situation lets say collected data unique entities data set also data collected different days created x matrix matlab columns representing unique entities rows days seen entities seen day seen even days entries matrix binary whether entity collected day colleague started making stacked bar chart matlab looks horrendous somone called eye chart tasked making something thats eye chart anyone reccomendations visualize data thinking dash seaborn even matplotlib stacked bar chart would better knows using opportunity learn something new hopefully python using matlab scholastic work pursits proficient non oop programming c remember little python experimenting tensorflow keras lately understand basic concepts oop would really like try python first learn something else like r road thanks python visualization x matrix binary data
174,helpseeker8390,1526368865.0,8jjpbr,4,datascience,"I have working on a analytics project using R. As a part of data preparation module I got stuck up with a specific task. I have a categorical column and a response variable as below example:

Features | Yes/No
---------|----------
a  | No 
b  | Yes
c  | No
b  | No
d  | No 
e  | Yes
a  | No
f   | No

I need to construct sequential fills as below. It is constructed as below:

Consider step =3. From the actual data consider first 3 rows a,b,c and yes/no column has one 'Yes'. So the respective values of a,b,c,d,e,f  in the first row of resultant matrix is filled as 1,1,1,0,0,0 with Yes.
The next step has b,c,b, so the resultant matrix is filled as 0,2,1,0,0,0 with Yes. This process should be repeated until the last sequence in the source data. 

a	|b 	  |c	    |d	      |e	|f	  |Yes/No
------|-------|-------|------|-------|-------|---------
1      |1       |1	    |0	      |0	|0	  |Yes
0	|2	  |1	    |0	      |0	|0	  |Yes
0	|1	  |1	    |1       |0	|0	  |No
0	|1	  |0	    |1	      |1	|0	  |Yes
1	|0	  |0	    |1	      |1	|0	  |Yes
1	|0	  |0	    |0	      |1	|1	  |Yes

Is there any possibility of constructing the above. Can anyone please help on building this logic to construct the above resultant matrix using R.

Thanking you in advance.
Constructing sequential matrix",working analytics project using r part data preparation module got stuck specific task categorical column response variable example features yes b yes c b e yes f need construct sequential fills constructed consider step actual data consider first rows b c yes column one yes respective values b c e f first row resultant matrix filled yes next step b c b resultant matrix filled yes process repeated last sequence source data b c e f yes yes yes yes yes yes possibility constructing anyone please help building logic construct resultant matrix using r thanking advance constructing sequential matrix
