,author,created_utc,id,num_comments,subreddit,text,clean_text
516,lostindakotas,1523895017.0,8cooly,17,genetics,"I always here it is ""only"" 4% DNA in modern humans that comes from Neanderthals. 

But why is that considered so small? 

We have only a 5% difference with mice!

1.5% difference with chimps. 

Additionally, there is a .1% difference between races. Yet some races have up to 4% Neanderthal DNA, and some 0%. So how do they get .1%? That should be 4% difference. And if there is 4% difference between some races, and 1.5% difference between chimps, how does that prove there is no race?

Likewise, there are some people today, that are nearly clones of Neanderthals. How do we explain that as only a max of 4%?

Sorry I am a noob.Effect of Neanderthal DNA?",always dna modern humans comes neanderthals considered small difference mice difference chimps additionally difference races yet races neanderthal dna get difference difference races difference chimps prove race likewise people today nearly clones neanderthals explain max sorry noob effect neanderthal dna
517,flashbros61,1523939318.0,8ctwmp,2,genetics,It is extremely strange. I am like an identical copy of my dad. I cant understand it. Just saw a picture of him young today. Am i half of my mom or half dad or more of my mom and less of my dad? Does it even out to 50 50 or are my percentages after my 50 50 chances 80 - 20?I look identical to my dad when he was my age. I thought genes are 50 50?,extremely strange like identical copy dad cant understand saw picture young today half mom half dad mom less dad even percentages chances look identical dad age thought genes
518,slippy0101,1523900507.0,8cpexk,0,genetics,"Turns out I'm only 42% genetically related to my brother and that seems like it's a pretty extreme outlier of what would be expected of true siblings.  Has anyone seen less than that? Has anyone seen the flipside and seen siblings related far more than expected?

Edit: If anyone reads this, I'd like to add that both that brother and I are over 50% related to the third brother (52% and 51%) so it's impossible that he's not a full sibling. What's the least and most genetically related you've seen true siblings be?",turns genetically related brother seems like pretty extreme outlier would expected true siblings anyone seen less anyone seen flipside seen siblings related far expected edit anyone reads like add brother related third brother impossible full sibling least genetically related seen true siblings
519,wewewawa,1523927223.0,8cspee,2,genetics,The Best DNA Ancestry Test,best dna ancestry test
520,whyamialivetoday,1523910399.0,8cqqgj,8,genetics,"Not sure if this is the right subreddit but why is my thumbnail so short, I do bite it but it seems unusually far down compared to my other nails",sure right subreddit thumbnail short bite seems unusually far compared nails
521,xblushpink,1523921646.0,8cs3fe,2,genetics,"I am trying to understand the problems with genome-wide association studies (GWAS) and I'm struggling to understand what synthetic association is? 

In specific relation to this paper: http://journals.plos.org/plosbiology/article?id=10.1371/journal.pbio.1000580

Thank youGWAS and Issues; Synthetic Variation - Can Someone Please Explain",trying understand problems genome wide association studies gwas struggling understand synthetic association specific relation paper http journals plos org plosbiology article id journal pbio thank yougwas issues synthetic variation someone please explain
522,understanding0,1523901527.0,8cpjs2,0,genetics,Would it be possible to completely eliminate a bed bug infestation in a hotel room by introducing genetically modified bed bugs ([using the CRISPR/Cas9-gene-drive](https://en.wikipedia.org/wiki/Gene_drive#CRISPR/Cas9)) into the bed bug colonies in that room? Would that be economically feasible and cheaper than the current approaches? Furthermore what are the risks?gene drive and bed bugs,would possible completely eliminate bed bug infestation hotel room introducing genetically modified bed bugs using crispr cas gene drive https en wikipedia org wiki gene drive crispr cas bed bug colonies room would economically feasible cheaper current approaches furthermore risks gene drive bed bugs
523,hellaworried,1523890473.0,8co3o9,3,genetics,"""If the sequence 3’  AGG ATG TAC GAA GCC AAA CGA 5’ lies on the template strand of the region of a chromosome encoding the start of a gene product, what will the third amino acid in the initial protein product be ?""

Here's my thought process:

- The mRNA strand is 5' UCC UAC AUG CUU CGG UUU GCU 3'

- mRNA is translated 5' to 3', so the third amino acid is AUG, which codes for Met.

However the answer key says it should be Arg. Any help is appreciated.

Question about translation",sequence agg atg tac gaa gcc aaa cga lies template strand region chromosome encoding start gene product third amino acid initial protein product thought process mrna strand ucc uac aug cuu cgg uuu gcu mrna translated third amino acid aug codes met however answer key says arg help appreciated question translation
524,collwen,1523863343.0,8clrwv,6,genetics,"I would like to write a short paragraph in my thesis (which is not related to genetics at all) about how technological advancements accelerated, for example, the determination of the human genome. I found that the sequencing technique - which made it possible to do this at all - was published in 1977 (Sanger). Of course, I read in the history of the HGP that in 1990 they estimated 2005 as the finish year, but by 2003 the majority of the genes were already explored. 

My question: I vaguely remember reading somewhere that around 1980 scientists predicted about 50-100 years to finish the work and it's thanks to the technological boom that they finished so much earlier. Is there any reliable source that supports this? Also, which technologies would you consider had the main impact on speeding up the process? 

I hope someone can help me with this, in the meantime I will keep reading... Thank you[Question] Predicted finishing date of mapping the human genome",would like write short paragraph thesis related genetics technological advancements accelerated example determination human genome found sequencing technique made possible published sanger course read history hgp estimated finish year majority genes already explored question vaguely remember reading somewhere around scientists predicted years finish work thanks technological boom finished much earlier reliable source supports also technologies would consider main impact speeding process hope someone help meantime keep reading thank question predicted finishing date mapping human genome
525,yashoza,1523839127.0,8cjn1j,2,genetics,"Let's say there is a population that has never been sequenced before and has experienced varying levels of admixture from multiple sources at different times. There is ancient admixture and recent admixture. Also, the population is highly consanguineous, but also very genetically diverse and did not originate from a small founder population (like Ashkenazi Jews for example), meaning that there is far less identity by state between any two unrelated individuals than one would expect in a consanguineous population.

PCA indicates that there is a high degree of stratification in terms of ancestry and non-random mating, but also that there is no directly applicable reference population panel that can be used for haplotype frequency estimation and phasing. Let's just say that I have multiple reasons - theoretical and results wise - to believe that my current efforts have not worked correctly due to these reasons. If you doubt this, please let me know why because I have not been formally trained in this area.

This population now needs to be sequenced. Let's assume that whole exome sequencing will be performed on ~ 300 unrelated samples. Would this be enough? Or would whole-genome genotyping on SNP arrays need to be performed on the samples, as well as on related individuals?

Any insight would be helpful. Thank you.Statistical Genetics - What information is required for haplotype phasing in a novel, admixed population?",let say population never sequenced experienced varying levels admixture multiple sources different times ancient admixture recent admixture also population highly consanguineous also genetically diverse originate small founder population like ashkenazi jews example meaning far less identity state two unrelated individuals one would expect consanguineous population pca indicates high degree stratification terms ancestry non random mating also directly applicable reference population panel used haplotype frequency estimation phasing let say multiple reasons theoretical results wise believe current efforts worked correctly due reasons doubt please let know formally trained area population needs sequenced let assume whole exome sequencing performed unrelated samples would enough would whole genome genotyping snp arrays need performed samples well related individuals insight would helpful thank statistical genetics information required haplotype phasing novel admixed population
526,xblushpink,1523830104.0,8cio5g,7,genetics,"I have a medical genetics exam coming up and I'm stressing a lot over it compared to my other exams. We have to be able to write essays on the genetic mutations associated with various diseases including both obvious monogenic genetic disorders (e.g. Haemophilia) and more complex (e.g. obesity). 

I'm struggling because I feel like my work at the moment is purely descriptive of the symptoms and clinical presentation without really going into the genetic mechanisms behind the diseases. But then when I study the genetic mechanisms I find them really confusing and so all I take away from papers are that they are caused my missense mutations/frameshifts/mRNA degradation/insertions/deletions/gross deletions/recombination with a pseudogene etc. However then it seems like they are all caused by the same types of mutation so it just seems shallow and insufficient to put that ""X disease can be caused by missense mutations/frameshifts/mRNA degradation/insertions/deletions/gross deletions/recombination with a pseduogene in gene Y""

Does anyone have any advice or study suggestions? Thank you

How to study for my medical genetics (undergraduate)",medical genetics exam coming stressing lot compared exams able write essays genetic mutations associated various diseases including obvious monogenic genetic disorders e g haemophilia complex e g obesity struggling feel like work moment purely descriptive symptoms clinical presentation without really going genetic mechanisms behind diseases study genetic mechanisms find really confusing take away papers caused missense mutations frameshifts mrna degradation insertions deletions gross deletions recombination pseudogene etc however seems like caused types mutation seems shallow insufficient put x disease caused missense mutations frameshifts mrna degradation insertions deletions gross deletions recombination pseduogene gene anyone advice study suggestions thank study medical genetics undergraduate
527,NetherLewis,1523810542.0,8cgc0b,5,genetics,"I am stuck with this past paper question:

Explain why carrier females are usually not affected by diabetes insipidus even though they carry a mutated copy of the gene.

The stem of the question says that the mutation is recessive. 

The answer talks about X-inactivation and how only about half of the cells that express the gene would have the mutation.

I would have thought that since it was recessive and that it was about carrier females, that it wouldn't even be necessary to go into X-inactivation because if someone was a carrier for an autosomal recessive condition they wouldn't have the disease because they have at least one copy of the functional gene.

X-inactivation",stuck past paper question explain carrier females usually affected diabetes insipidus even though carry mutated copy gene stem question says mutation recessive answer talks x inactivation half cells express gene would mutation would thought since recessive carrier females even necessary go x inactivation someone carrier autosomal recessive condition disease least one copy functional gene x inactivation
528,FutureSalesBoi,1523750795.0,8cbl2c,2,genetics,"So, for anyone familiar with mosquito-based gene drive systems: when a gene drive construct is inserted into a G0 individual, why doesn't the construct copy itself to that individual's remaining WT chromosome? Shouldn't a promoter like vasa force that to happen at meiosis? Why do we only begin to see this happen at the G1 generation?Question about gene drives",anyone familiar mosquito based gene drive systems gene drive construct inserted g individual construct copy individual remaining wt chromosome promoter like vasa force happen meiosis begin see happen g generation question gene drives
529,myrmekiteisallright,1523757334.0,8cc7eh,3,genetics,"Amateur genetics person.

Is there a genetics tool or software package that displays raw data for different people (i.e. human 1 vs human 2 vs human 3...) for populations of hundreds or thousands of samples?

I'm trying to compile a database of raw data for a control population vs a diseased population by examining the genotypes at similar loci, chromosome by chromosome. 

Along the lines of the utility seen here, but for much larger populations:
www.math.mun.ca/~dapike/FF23utils/strand.php

I'm manually combining files myself, but it's a long process and I'm hoping there are better tools out there. 

It is a brute force way of looking at the data, but I've used this technique in other population/statistics with good results and would like to try it on genetic data. It's very forgiving of repeats, missing data, flagging incorrect data and can be converted to derivative maps to highlight AOIs in very, very noisy data.

Thanks. Tool for whole genome comparison in analysis of a diseased population?",amateur genetics person genetics tool software package displays raw data different people e human vs human vs human populations hundreds thousands samples trying compile database raw data control population vs diseased population examining genotypes similar loci chromosome chromosome along lines utility seen much larger populations www math mun ca dapike ff utils strand php manually combining files long process hoping better tools brute force way looking data used technique population statistics good results would like try genetic data forgiving repeats missing data flagging incorrect data converted derivative maps highlight aois noisy data thanks tool whole genome comparison analysis diseased population
530,ketodownsouth,1523741894.0,8caoei,2,genetics,"Hi all, throwaway account.

I am very interested in genetics and have a Promethease report.

My face is very assymmetrical, and was worse when first born. My mum says it was very obvious - main thing being my ears weren’t straight. My face has ‘evened out’ with age but it still very asymmetrical - I honestly look like a different person on left vs right side; I think my left side looks like my brother and my right more like another side of the family. Not even sure that this is possible? My vision is poor but much worse in one eye, and my ears are different shape/size too. My hips are different - one higher.

Would love to hear if this is common :)My face is very assymmetrical, is this genetic",hi throwaway account interested genetics promethease report face assymmetrical worse first born mum says obvious main thing ears straight face evened age still asymmetrical honestly look like different person left vs right side think left side looks like brother right like another side family even sure possible vision poor much worse one eye ears different shape size hips different one higher would love hear common face assymmetrical genetic
531,Neuronologist,1523704257.0,8c6wqb,0,genetics,"Interview with Neurogeneticist Dr. Mark Cookson on GWAS, the Origins of Life, Unbiased Science and more",interview neurogeneticist dr mark cookson gwas origins life unbiased science
532,law0fattraction,1523727499.0,8c92tg,2,genetics,"I assume the two animales cannot produce fertile offspring through their own means, are there any scientific procedures that exist as potential alternatives?Is it possible to create a chicken/turkey hybrid?",assume two animales cannot produce fertile offspring means scientific procedures exist potential alternatives possible create chicken turkey hybrid
533,vibrant_pastel,1523669167.0,8c4b0z,4,genetics,"Hi,

My sister and I were adopted, and her results show we are actually half sisters. She matched to her grandmother, found her on facebook, and saw that she has one son, who must be her father. That man has two children, one of whom also took a 23andme test and matched to the grandmother as well. However, my sister and her potential father's son only match as 2nd cousins with 5% DNA.

What explanations could there be here? Maybe they just don't share much DNA and grandmother secretly has another son, making them first cousins? Or maybe there was a mixup in the lab? I just don't see how a pair of second cousins can share a grandmother.Help with a 23andme DNA relative...situation?",hi sister adopted results show actually half sisters matched grandmother found facebook saw one son must father man two children one also took andme test matched grandmother well however sister potential father son match nd cousins dna explanations could maybe share much dna grandmother secretly another son making first cousins maybe mixup lab see pair second cousins share grandmother help andme dna relative situation
534,PupilX,1523716679.0,8c7xcw,1,genetics,"I have nine discussion questions I need answered by anyone who is well, or halfway decently versed in genetics. I go to my professor's office hours often, and I find that other students are in more need of her than I am. So any help with these would be greatly appreciated. Thanks in advance!

* **Describe how eukaryotic pre-mRNA is processed into mature mRNA and why each modification is necessary for gene expression. Be sure to be VERY SPECIFIC in the exact modifications that are made.**
.
.
* **Describe and discuss the process of transcription initiation in bacteria, including all of the trans-acting and cis-acting molecules (that we discussed in class) that are involved and how each contributes to the success of initiation of transcription**
.
.
* **Describe the structure of a typical eukaryotic gene, including only the cis-acting factors that are involved in transcription, pre-mRNA processing, and translation. Discuss which cis-acting factors are present in the gene, the pre-mRNA, and the mature mRNA**
.
.
* **Complementary base-pairing is important in most processes involving DNA and RNA, including gene expression. Describe as many steps during translation where complementary base-pairing is essential to gene expression. Be sure to include what molecules are base-pairing, and how this base-pairing contributes to gene expression.**
.
.
* **Discuss the concept of degeneracy in the genetic code. What is the physical basis of the degeneracy?**
.
.
* **Why are some genes regulated and some genes not regulated? Use a specific example for each gene type.**
.
.
* **Discuss the types of genes that are inducible and the types of genes that are repressible. Why would a gene need to be inducible? Why would a gene need to be repressible?**
.
.
* **Why are there extra steps involved in eukaryotic gene regulation that are not present in bacterial gene regulation?**
.
.
* **Regulation of eukaryotic genes involves changes to chromatin as well as activation of the promoter. However, it can be said that chromatin changes are more important than activation of the promoter—why?**Help For A Genetics Test",nine discussion questions need answered anyone well halfway decently versed genetics go professor office hours often find students need help would greatly appreciated thanks advance describe eukaryotic pre mrna processed mature mrna modification necessary gene expression sure specific exact modifications made describe discuss process transcription initiation bacteria including trans acting cis acting molecules discussed class involved contributes success initiation transcription describe structure typical eukaryotic gene including cis acting factors involved transcription pre mrna processing translation discuss cis acting factors present gene pre mrna mature mrna complementary base pairing important processes involving dna rna including gene expression describe many steps translation complementary base pairing essential gene expression sure include molecules base pairing base pairing contributes gene expression discuss concept degeneracy genetic code physical basis degeneracy genes regulated genes regulated use specific example gene type discuss types genes inducible types genes repressible would gene need inducible would gene need repressible extra steps involved eukaryotic gene regulation present bacterial gene regulation regulation eukaryotic genes involves changes chromatin well activation promoter however said chromatin changes important activation promoter help genetics test
535,A_Lazko,1523605044.0,8bxeve,1,genetics,The Surprising Way Saliva Brought These Six Strangers Together,surprising way saliva brought six strangers together
536,Jishuah,1523564101.0,8bt9z9,14,genetics,"I'm not sure if this is the place to post here, but I am currently in my second year studying molecular biology at the university of Pittsburgh. I've started doing a little bit of undergraduate research, but I'm having a hard time finding a good graduate program. I really would like to do research regarding genetic engineering, but it seems as though most programs that are related are biotechnology. Should I be planning to go into grad school with biotechnology and try to get experience with genetic engineering research? The path is kinda foggy for me, and no one in my family is really in the  STEM field. Thank you for any advice! Can anyone in the field offer some advice as to what I should be expecting in pursuing a career in genetics?",sure place post currently second year studying molecular biology university pittsburgh started little bit undergraduate research hard time finding good graduate program really would like research regarding genetic engineering seems though programs related biotechnology planning go grad school biotechnology try get experience genetic engineering research path kinda foggy one family really stem field thank advice anyone field offer advice expecting pursuing career genetics
537,purpleeclipse19,1523584284.0,8bvmig,1,genetics,"Hi all, I’m trying to compile some scientific papers for a review paper I’m having to compose for class. Problem is, I’m having trouble finding good scientific papers that are fairy new (2010 and older preferably) dealing with the genetic aspect of Huntington’s Disease (and new experiments to try to help with it). Any links and/or suggestions for a conclusion for this paper would be greatly appreciated. Huntington’s Developments",hi trying compile scientific papers review paper compose class problem trouble finding good scientific papers fairy new older preferably dealing genetic aspect huntington disease new experiments try help links suggestions conclusion paper would greatly appreciated huntington developments
538,greybeh,1523533845.0,8bpjed,8,genetics,"I've learned that my great, great, great grandmothers were sisters. I wondered if this could have any bearing on some health issues I have. 

My guess is no. That doesn't seem to be a very close relationship. My mother and I both have widespread osteoarthritis that started when she was in her teens, me in my 20's and hers is aggressive.  (her back is messed up) We've got other stuff going on - sleep apnea, major reactive allergy stuff (me: adult-onset food allergies) and me: a possible connective tissue disease, both of us: sleep apnea, me: possible narcolepsy. 

I've wondered, basically if it's worth mentioning what I know to my doctors about my g-g-g grandmothers. I think it's probably irrelevant, but I'd be glad to know. Thanks!  Inbreeding?",learned great great great grandmothers sisters wondered could bearing health issues guess seem close relationship mother widespread osteoarthritis started teens aggressive back messed got stuff going sleep apnea major reactive allergy stuff adult onset food allergies possible connective tissue disease us sleep apnea possible narcolepsy wondered basically worth mentioning know doctors g g g grandmothers think probably irrelevant glad know thanks inbreeding
539,glittertechnic,1523483243.0,8bkxhw,11,genetics,"What are some potential causes of the ""peaking"" error in this gel?",potential causes peaking error gel
540,obenzell,1523487199.0,8blekr,1,genetics,Gene Editing for Good by Bill Gates,gene editing good bill gates
541,HaylertheSailor,1523511303.0,8bnv3b,10,genetics,What do you guys think?,guys think
542,subjectivist,1523456234.0,8bhe8u,4,genetics,"Hello, B.S. in bioengineering. Weighing grad school options. A&amp;P, biology, biochem, organic chemistry are some classes I've taken. 

I have yet to look at the course requirements for genetics, but would like to jump into a good introductory, but still technical, book.

Any suggestions or advice would be appreciated.Suggestions for a introductory genetics book for a STEM individual.",hello b bioengineering weighing grad school options amp p biology biochem organic chemistry classes taken yet look course requirements genetics would like jump good introductory still technical book suggestions advice would appreciated suggestions introductory genetics book stem individual
